id,title,field_paragraphs,field_description,field_media_canonical_image
1,Lorem ipsum,1,"Lorem ipsum dolor sit amet, consectetur adipiscing elit. Nam de summo mox, ut dixi, videbimus et ad id explicandum disputationem omnem conferemus.",1
2,Dolor sit amet,2,"Indicant pueri, in quibus ut in speculis natura cernitur. Quare ad ea primum, si videtur; Id enim volumus, id contendimus, ut officii fructus sit ipsum officium.",2
3,"Illa argumenta pro
",3,"Lorem ipsum dolor sit amet, consectetur adipiscing elit.",3
4,Videmus igitur ut conquiescere,4,"Duo Reges: constructio interrete. Quicquid porro animo cernimus, id omne oritur a sensibus.",4
5,"Aliter enim explicari, quod quaeritur, non potest.
",5,"Aliter enim explicari, quod quaeritur, non potest. Iam in altera philosophiae parte. Videsne quam sit magna dissensio?",5
6,Sed quod proximum fuit non vidit,6,"Quod cum accidisset ut alter alterum necopinato videremus, surrexit statim.",6
7,At iam decimum annum in spelunca iacet,7,"Octavio fuit, cum illam severitatem in eo filio adhibuit, quem in adoptionem D. Aliud igitur esse censet gaudere, aliud non dolere.",7
