id,field_p_text
1,"<p>Lorem ipsum dolor sit amet, consectetur adipiscing elit. Quodcumque in mentem incideret, et quodcumque tamquam occurreret. Ego vero isti, inquam, permitto. <b>Sed plane dicit quod intellegit.</b> Fieri, inquam, Triari, nullo pacto potest, ut non dicas, quid non probes eius, a quo dissentias. Cur fortior sit, si illud, quod tute concedis, asperum et vix ferendum putabit? <b>Quodsi ipsam honestatem undique pertectam atque absolutam.</b> Si longus, levis dictata sunt. Duo Reges: constructio interrete. </p>

<p>Hoc loco tenere se Triarius non potuit. <mark>Quid iudicant sensus?</mark> Quid ergo aliud intellegetur nisi uti ne quae pars naturae neglegatur? Cur igitur, inquam, res tam dissimiles eodem nomine appellas? <mark>Istam voluptatem, inquit, Epicurus ignorat?</mark> Si mala non sunt, iacet omnis ratio Peripateticorum. </p>

<p>Verba tu fingas et ea dicas, quae non sentias? Hi curatione adhibita levantur in dies, valet alter plus cotidie, alter videt. Hoc loco tenere se Triarius non potuit. Atqui haec patefactio quasi rerum opertarum, cum quid quidque sit aperitur, definitio est. Hic ambiguo ludimur. Ex eorum enim scriptis et institutis cum omnis doctrina liberalis, omnis historia. </p>

"
2,"<p>Lorem ipsum dolor sit amet, consectetur adipiscing elit. Nihil minus, contraque illa hereditate dives ob eamque rem laetus. Qua tu etiam inprudens utebare non numquam. Ea, quae dialectici nunc tradunt et docent, nonne ab illis instituta sunt aut inventa sunt? Illud quaero, quid ei, qui in voluptate summum bonum ponat, consentaneum sit dicere. Urgent tamen et nihil remittunt. Duo Reges: constructio interrete. At multis se probavit. </p>

<p>Ergo illi intellegunt quid Epicurus dicat, ego non intellego? Quid loquor de nobis, qui ad laudem et ad decus nati, suscepti, instituti sumus? <a href=""http://loripsum.net/"" target=""_blank"">Quare conare, quaeso.</a> Apud ceteros autem philosophos, qui quaesivit aliquid, tacet; Qui bonum omne in virtute ponit, is potest dicere perfici beatam vitam perfectione virtutis; Sed tamen est aliquid, quod nobis non liceat, liceat illis. <b>Non risu potius quam oratione eiciendum?</b> Est enim effectrix multarum et magnarum voluptatum. Sic consequentibus vestris sublatis prima tolluntur. Cur tantas regiones barbarorum pedibus obiit, tot maria transmisit? Sin tantum modo ad indicia veteris memoriae cognoscenda, curiosorum. Qua tu etiam inprudens utebare non numquam. </p>

<p>Dic in quovis conventu te omnia facere, ne doleas. Mihi enim erit isdem istis fortasse iam utendum. Ergo instituto veterum, quo etiam Stoici utuntur, hinc capiamus exordium. Quod iam a me expectare noli. </p>

"
3,"<p>Lorem ipsum dolor sit amet, consectetur adipiscing elit. <i>Id mihi magnum videtur.</i> <i>Tuo vero id quidem, inquam, arbitratu.</i> <a href=""http://loripsum.net/"" target=""_blank"">Nescio quo modo praetervolavit oratio.</a> Illa videamus, quae a te de amicitia dicta sunt. Sit hoc ultimum bonorum, quod nunc a me defenditur; <a href=""http://loripsum.net/"" target=""_blank"">Duo Reges: constructio interrete.</a> <a href=""http://loripsum.net/"" target=""_blank"">Primum quid tu dicis breve?</a> An eum discere ea mavis, quae cum plane perdidiceriti nihil sciat? </p>

<p>Dicam, inquam, et quidem discendi causa magis, quam quo te aut Epicurum reprehensum velim. Non quaero, quid dicat, sed quid convenienter possit rationi et sententiae suae dicere. <mark>Inde igitur, inquit, ordiendum est.</mark> <a href=""http://loripsum.net/"" target=""_blank"">Quid censes in Latino fore?</a> <b>Quid adiuvas?</b> Vide, ne etiam menses! nisi forte eum dicis, qui, simul atque arripuit, interficit. </p>

<p>Quae tamen a te agetur non melior, quam illae sunt, quas interdum optines. Dicimus aliquem hilare vivere; Inde sermone vario sex illa a Dipylo stadia confecimus. <a href=""http://loripsum.net/"" target=""_blank"">Polycratem Samium felicem appellabant.</a> Videsne ut, quibus summa est in voluptate, perspicuum sit quid iis faciendum sit aut non faciendum? <b>Mihi, inquam, qui te id ipsum rogavi?</b> </p>

"
4,"<p>Lorem ipsum dolor sit amet, consectetur adipiscing elit. Non minor, inquit, voluptas percipitur ex vilissimis rebus quam ex pretiosissimis. Sed tu istuc dixti bene Latine, parum plane. <i>Maximus dolor, inquit, brevis est.</i> <a href=""http://loripsum.net/"" target=""_blank"">Confecta res esset.</a> </p>

<p>Roges enim Aristonem, bonane ei videantur haec: vacuitas doloris, divitiae, valitudo; Voluptatem cum summum bonum diceret, primum in eo ipso parum vidit, deinde hoc quoque alienum; Quia nec honesto quic quam honestius nec turpi turpius. Sin dicit obscurari quaedam nec apparere, quia valde parva sint, nos quoque concedimus; Nulla profecto est, quin suam vim retineat a primo ad extremum. Huius ego nunc auctoritatem sequens idem faciam. Quae cum magnifice primo dici viderentur, considerata minus probabantur. Sed tamen omne, quod de re bona dilucide dicitur, mihi praeclare dici videtur. Nobis aliter videtur, recte secusne, postea; </p>

<p><i>Duo Reges: constructio interrete.</i> Profectus in exilium Tubulus statim nec respondere ausus; Tanta vis admonitionis inest in locis; Qui autem esse poteris, nisi te amor ipse ceperit? Hoc mihi cum tuo fratre convenit. Quo studio Aristophanem putamus aetatem in litteris duxisse? Quid enim necesse est, tamquam meretricem in matronarum coetum, sic voluptatem in virtutum concilium adducere? Superiores tres erant, quae esse possent, quarum est una sola defensa, eaque vehementer. </p>

"
5,"<h1>Indicant pueri, in quibus ut in speculis natura cernitur.</h1>

<p>Lorem ipsum dolor sit amet, consectetur adipiscing elit. <a href=""http://loripsum.net/"" target=""_blank"">Equidem, sed audistine modo de Carneade?</a> Tanti autem aderant vesicae et torminum morbi, ut nihil ad eorum magnitudinem posset accedere. Duo Reges: constructio interrete. <b>Tu quidem reddes;</b> Videmusne ut pueri ne verberibus quidem a contemplandis rebus perquirendisque deterreantur? Quis, quaeso, illum negat et bonum virum et comem et humanum fuisse? Ergo hoc quidem apparet, nos ad agendum esse natos. Ex eorum enim scriptis et institutis cum omnis doctrina liberalis, omnis historia. </p>

<p><a href=""http://loripsum.net/"" target=""_blank"">Quid iudicant sensus?</a> <i>Uterque enim summo bono fruitur, id est voluptate.</i> Quis enim redargueret? <mark>Sed mehercule pergrata mihi oratio tua.</mark> <b>Quis istum dolorem timet?</b> <mark>Venit ad extremum;</mark> </p>

<h2>Quid enim est a Chrysippo praetermissum in Stoicis?</h2>

<p>Sin laboramus, quis est, qui alienae modum statuat industriae? Quodcumque in mentem incideret, et quodcumque tamquam occurreret. Profectus in exilium Tubulus statim nec respondere ausus; <a href=""http://loripsum.net/"" target=""_blank"">Tanta vis admonitionis inest in locis;</a> Nec vero alia sunt quaerenda contra Carneadeam illam sententiam. Consequatur summas voluptates non modo parvo, sed per me nihilo, si potest; Nullus est igitur cuiusquam dies natalis. Quid enim est a Chrysippo praetermissum in Stoicis? </p>

"
6,"<h1>Ex quo illud efficitur, qui bene cenent omnis libenter cenare, qui libenter, non continuo bene.</h1>

<p>Lorem ipsum dolor sit amet, consectetur adipiscing elit. Apparet statim, quae sint officia, quae actiones. <b>Pollicetur certe.</b> Audeo dicere, inquit. Duo Reges: constructio interrete. <a href=""http://loripsum.net/"" target=""_blank"">Suo genere perveniant ad extremum;</a> Quia dolori non voluptas contraria est, sed doloris privatio. Quod mihi quidem visus est, cum sciret, velle tamen confitentem audire Torquatum. Facile est hoc cernere in primis puerorum aetatulis. </p>

<h2>Illud dico, ea, quae dicat, praeclare inter se cohaerere.</h2>

<p>Primum cur ista res digna odio est, nisi quod est turpis? Tecum optime, deinde etiam cum mediocri amico. Ergo et avarus erit, sed finite, et adulter, verum habebit modum, et luxuriosus eodem modo. <a href=""http://loripsum.net/"" target=""_blank"">Peccata paria.</a> Qui autem de summo bono dissentit de tota philosophiae ratione dissentit. Quid, si non sensus modo ei sit datus, verum etiam animus hominis? Habent enim et bene longam et satis litigiosam disputationem. Videsne, ut haec concinant? </p>

<p>Gracchum patrem non beatiorem fuisse quam fillum, cum alter stabilire rem publicam studuerit, alter evertere. <i>Apparet statim, quae sint officia, quae actiones.</i> <i>Philosophi autem in suis lectulis plerumque moriuntur.</i> Familiares nostros, credo, Sironem dicis et Philodemum, cum optimos viros, tum homines doctissimos. Quod non faceret, si in voluptate summum bonum poneret. An, partus ancillae sitne in fructu habendus, disseretur inter principes civitatis, P. Nonne igitur tibi videntur, inquit, mala? </p>

"
7,"<h1>Tu vero, inquam, ducas licet, si sequetur;</h1>

<p>Lorem ipsum dolor sit amet, consectetur adipiscing elit. <a href=""http://loripsum.net/"" target=""_blank"">Huius ego nunc auctoritatem sequens idem faciam.</a> An ea, quae per vinitorem antea consequebatur, per se ipsa curabit? Haec quo modo conveniant, non sane intellego. Quae cum magnifice primo dici viderentur, considerata minus probabantur. Tu enim ista lenius, hic Stoicorum more nos vexat. Duo Reges: constructio interrete. Nec lapathi suavitatem acupenseri Galloni Laelius anteponebat, sed suavitatem ipsam neglegebat; </p>

<h2>Quae est igitur causa istarum angustiarum?</h2>

<p>Hoc loco tenere se Triarius non potuit. <a href=""http://loripsum.net/"" target=""_blank"">Efficiens dici potest.</a> <b>Erat enim Polemonis.</b> Ratio enim nostra consentit, pugnat oratio. Qui autem esse poteris, nisi te amor ipse ceperit? Bona autem corporis huic sunt, quod posterius posui, similiora. </p>

<p><i>Disserendi artem nullam habuit.</i> Duo enim genera quae erant, fecit tria. <mark>Si longus, levis.</mark> <i>Ergo ita: non posse honeste vivi, nisi honeste vivatur?</i> Egone non intellego, quid sit don Graece, Latine voluptas? Profectus in exilium Tubulus statim nec respondere ausus; </p>

"